{
  "schema_version": 2,
  "generated_at": "2026-10-22T17:37:37.752498+00:00",
  "scope": "local-calibration",
  "image": "php:8.1.34-apache",
  "image_digest": "php@sha256:72f0c0134922985022d55a39b0390d35dc7a10e961aa6c44fa35b4c3102f4268",
  "php_version": "8.1.34",
  "branch": "8.1",
  "fixed_in": null,
  "arch": "amd64",
  "distro": "trixie",
  "sapi": "apache2handler",
  "upstream_commit": "4586f5cc120c82fd468b17469202bac629810ad9",
  "libphp_path": "/usr/lib/apache2/modules/libphp.so",
  "libphp_sha256": "d92ab65c24d3f3d1528fffb716a35dccf2bfdd0e74618f8bc2e4d5376a04496b",
  "libphp": {
    "zif_system": "0x36f470",
    "zval_ptr_dtor": "0x457150",
    "htdata": null
  },
  "stages": {
    "stage1_n": 0,
    "stage1_forge_len": 0,
    "stage2_t": 0,
    "stage2_v": 0,
    "stage3_pads": null,
    "stage3_carrier": null
  },
  "measured": {
    "zend_chunk_base": null,
    "libphp_base": null
  },
  "config": {
    "memory_limit": "8M",
    "session_upload_progress": "1",
    "workers": 1
  },
  "verified": false,
  "rce": false,
  "status": "calibration failed before complete ASLR disclosure"
}
