{
  "schema_version": 2,
  "generated_at": "2026-10-23T06:00:17.035640+00:00",
  "scope": "local-calibration",
  "image": "php:8.3.35-apache",
  "image_digest": "php@sha256:c59c808172ee3672cd334f8f2a5d7b1480a9d7273a368f412b8ee9b4ef418184",
  "php_version": "8.3.35",
  "branch": "8.3",
  "fixed_in": "8.3.36",
  "arch": "aarch64",
  "distro": "trixie",
  "sapi": "apache2handler",
  "upstream_commit": "4586f5cc120c82fd468b17469202bac629810ad9",
  "libphp_path": "/usr/lib/apache2/modules/libphp.so",
  "libphp_sha256": "1f2bc20742e619aaa66b389d16d9e1f6b059ea5108b4104ee8e6440df6dac631",
  "libphp": {
    "zif_system": "0x377428",
    "zval_ptr_dtor": "0x46fcc0",
    "htdata": null
  },
  "stages": {
    "stage1_n": 841,
    "stage1_forge_len": 63,
    "stage2_t": 406,
    "stage2_v": 16,
    "stage3_pads": null,
    "stage3_carrier": null
  },
  "measured": {
    "zend_chunk_base": "0x7fea54800000",
    "libphp_base": "0x7fea568a0000"
  },
  "config": {
    "memory_limit": "8M",
    "session_upload_progress": "1",
    "workers": 1
  },
  "verified": false,
  "rce": false,
  "status": "leaks calibrated; stage 3 not verified"
}
